0	score	hospital
โรงพยาบาลศิริราชเป็นโรงพยาบาลขนาดใหญ่ระดับต้นของประเทศ และมีคนไข้ไปรักษาที่นี่เยอะมากๆ เพราะวินิจฉัยโรคได้แม่นยำ และศักยภาพในการรักษาที่เพียบพร้อม คุณหมอใจดีมากๆ ทั้งที่คนไข้แต่ละวันมีจำนวนมาก แต่จากการวางระบบต่างๆที่ยอดเยี่ยม ทำให้ไม่เกิดความสับสนต่อคนไข้ และสะดวก รวดเร็วมาก ตั้งแต่ขั้นตอนการทำบัตร จนกระทั่งรอคิว และได้เข้าพบแพทย์ สามารถทำบัตรผู้ป่วยออนไลน์ได้ และยังสามารถนัดตรวจคลินิกพิเศษออนไลน์ได้ด้วย ประทับใจมากๆ	5	Siriraj
คุณหมอเข้าของไข้ผ่าตัดดี แต่นศพ ดึงสายเลือดออก จึงต้องทำให้ผ่ารอบสอง ต้องโทรหาอาจารย์ตลอดการผ่า รอดตายมาได้ จนทำให้คอเป็นถึงทุกวันนี้ คอยึด คอตึง กลืนยาเม็ดใหญ่ไม่ได้ พยาบาลแผนกคอนิสัยน่ารักแต่แผนงรังสี หมอดีค่ะ ให้คำปรึกษาดี ทุกอย่างโอเคหมด แย่ตรงผ่าคอรอบสองครั้งนั้นค่ะ จนเป็นปีแล้ว คอก็ไม่ดีขึ้นค่ะ	1	Siriraj
หมอสามารถให้คำปรึกษาได้ดีมาก ติดตามอาการการรักษาตลอด ไปหาหมอด้วยอาการปวดข้อเข่า หมอสามารถให้คำปรึกษาได้ดีมาก ติดตามอาการการรักษาตลอด ไปหาหมอด้วยอาการปวดข้อเข่า หมอสามารถให้คำปรึกษาได้ดีมาก ติดตามอาการการรักษาตลอด ไปหาหมอด้วยอาการปวดข้อเข่า หมอสามารถให้คำปรึกษาได้ดีมาก ติดตามอาการการรักษาตลอด ไปหาหมอด้วยอาการปวดข้อเข่า	5	Siriraj
"อาการนิ้วมือ นิ้วเท้า ชา ตลอดเวลา มกมากกว่า 1 ปี เคยรักษาแบบเวชศ่สตร์ฟื้นฟูกฌดีขึ้นเป็นพักๆ แล้วก็กลับมาเป็นอีก แรกๆนึกว่าเป็นเพราะหมอนรองกระดูกที้คอ และหลังเสื่อม จึงเป็รสาเหตุให้ชา แต่คุณหมอเวขศาสตร์บอกว่ายังไม่น่าใช่ ให้ลองพบหมอ neuro ดูก่อนคุณหมอ neuro ตรวจแล้ว พยว่าเส้นประสาทอักเสยเล็กน้อย ให้ทานสิตามินบำรุงแก้ชา"	4	Siriraj
ไปผ่าตัดเนื้อบอกในสมองเมื่อปี 2546 หมอทำให้ดิฉันเดินไม่ได้มาจนปัจจุบันเป็นเวลา 15 ปีแล้ว ซึ่งน้าชายของดิฉันก็จบแพทย์จากที่ศิริราชแล้วหมอที่ผ่าตัดให้ดิฉันก็จบหลังน้าชายของดิฉันอีกทำให้ดิฉันผิดหวังกับการรักษาในครั้งนี้มากๆเลยค่ะซึ่งครอบครัวฉันก็ไม่ได้มีฐานะอะไรมากมายเลยตาเป็นข้าราชการบำนาญยายเป็นแม่บ้าน	1	Siriraj
วันนี้ไปหาหมอศิริราช พอดีมีไข้ขึ้นสูง ไอจนเจ็บขึ้นสมอง อ่อนเพลียมาก ไอจนเจ็บหน้าอก ท้องเสีย ไข้ขึ้น ตอนแรกพยาบาล(เสื้อสีฟ้า)ที่อยู่ตรงยื่นบัตรเค้าบอกว่าไม่มีคิวให้คนไข้มาแจ้งตรงพยาบาลคัดกรองด้านหน้าสุดของตึก ย้ำ(พยาบาลที่อยู่หน้าสุด ตรงประชาสัมพันธ์) เราเดินมาเจอพยาบาลคนแรกเค้าก็เลยบอกว่าต้องรอรถเพราะถ้าเราไม่ไหวก็ต้องรอรถ จนเค้าคุยกับพยาบาลคนที่สองคนที่สองถามอีกครั้งว่าเป็นอะไร เราก็บอกเค้าบอกอาการไปอีกครั้ง พยาบาลบอกว่าเพราะไอใช่ไหมก็เลยเจ็บ เราก็บอกว่า เรามีไข้ขึ้นมาก อ่อนเพลีย ยืนจนไม่ไหวแล้ว พยาบาลคนนี้ก็บอกว่าเพราะไอเยอะมันก็เจ็บหน้าอก พยาบาลแจ้งว่าคนไข้ไอแล้วเจ็บมันเป็นเรื่องปกติ (คนนี้พูดไม่ดีเลย ไม่ดีเลยตะคอกใส่อีก แล้วพยาบาลก็พยายามบอกว่าไม่รู้มีคิวไหม) จนเรารอไม่ไหวก็เลยตัดสินใจไปร.พ.เอกชน สรุปว่าคือเราเป็นไข้หวัดใหญ่ สายพันธ์ A แค่อยากจะบอกพยาบาลว่า ถ้าเราไม่ป่วยเราคงไม่ไปร.พ.หรอก แล้วคำพูดที่ตะคอกใส่คนไข้อ่ะ มันไม่โอเค เพราะเค้าป่วยเค้าก็ไม่โอเคแล้วคุณเป็นพยาบาลอ่ะคุณมาพูดไม่ดีใส่เค้าอีกอ่ะ มันไม่โอเคค่ะ กับพยาบาลด้านหน้าตึกตรงประชาสัมพันธ์	3	Siriraj
โรงพยาบาลมีคลินิคผู้ป่วยนอก มีคนมาใช้บริการเยอะมาก แต่ผู้ให้บริการ ผู้ช่วยเข็น พยาบาล ก็ปฏิบัติต่อทุกคนเท่าเทียมและเป็นมิตร มีรอยยิ้ม มีการบริการที่ดี ให้คำแนะนำที่ดี ให้คำอธิบายต่างๆด้วยความใส่ใจและช่วยเหลือดีมาก ความประทับใจนี้ทำให้ลืมเรื่องรถติดและคนมากมายไปเลย ที่ประทับใจคือคุณหมอให้เวลากับคนไข้ ให้ความรู้และอธิบายอาการของโรค สอบถามและใส่ใจในอาการของคนไข้ดีมากค่ะ ทำให้คนป่วยมีความรู้สึกสบายใจที่อยากจะมารักษาที่นี่	3	Siriraj
เป็นโรงพยาบาลใหญ่ ที่อุปกรณ์ครบครัน เดินทางไปสะดวก คุณหมอและพยาบาลใส่ใจคนไข้ ดูแลดีมากๆ	5	Siriraj
สอบถามค่ะ มีใครจองคิวกับเว็บนี้แล้วได้คิวจริงๆบ้างคะแบบไปแล้วรักาาได้เลย คือกลัวเสียเวลา	5	Siriraj
โรงพยาบาลมีคลินิคผู้ป่วยนอก มีคนมาใช้บริการเยอะมาก แต่ผู้ให้บริการ ผู้ช่วยเข็น พยาบาล ก็ปฏิบัติต่อทุกคนเท่าเทียมและเป็นมิตร มีรอยยิ้ม มีการบริการที่ดี ให้คำแนะนำที่ดี ให้คำอธิบายต่างๆด้วยความใส่ใจและช่วยเหลือดีมาก ความประทับใจนี้ทำให้ลืมเรื่องรถติดและคนมากมายไปเลย ที่ประทับใจคือคุณหมอให้เวลากับคนไข้ ให้ความรู้และอธิบายอาการของโรค สอบถามและใส่ใจในอาการของคนไข้ดีมากค่ะ ทำให้คนป่วยมีความรู้สึกสบายใจที่อยากจะมารักษาที่นี่	5	Siriraj
ดิฉันมีอาการสะอึกไม่หยุดทุกๆครึ่งชม. ตอนกลางคืนแค่รู้สึกตัวตื่น พลิกตัว ก็เกิดอาการสะอึกขึ้นมา และมีอาการไอ ไอรุนแรง จนอ้วก เกิดอาการมา1เดือนแล้ว พอจะมีวิธีรักษามั้ยคะ	4	Siriraj
นั่งคุยปกติไม่มีอาการอะไรอยู่ๆก็ปวดท้องจื้ดขึ้นมาเลยแล้วท้องก็จะเริ่มแข็งขึ้นแล้วเมือนบวมขึ้นๆแล้วจะลุกขึ้นมานั่งไม่ได้พักนึงและเจ็บเป็นมารอบนี้รอบที่2แล้วอ่ะค่ะ	5	Siriraj
หมอกระดูก ห่วยแตก วินิจฉัยโดยไม่ตรวจอาการคนไข้	1	Siriraj
คุณหมอมีความน่ารัก เป็นกันเอง พยาบาลใจดี แม้ว่าจะผิดนัด แล้วคิวคุณหมอยาวมาก ก็ยังสามารถให้วอร์คอินเข้าไปได้ ต้องขอบคุณจริงๆค่ะ	5	Siriraj
กาให้บริการและการตรวจรักษาดีมากๆพูดจากับคนไข้ก็ยิ้มแย้ม  ผิดกับโรงพยาบาลรัฐบางแห่ง ตวาดคนไข้ซะไม่อยากไปหาเลย อยู่แถวสามพรานแต่นั่งรถไปหาหมอที่ศิริราชเสียเงินก็ยอมเพราะที่ รพ.ศิริราชบริการคนไข้ดีมากๆ	5	Siriraj
หนูไปพบหมอจิตแพทย์มาค่ะ หนูเป็นโรคทูเร็ตต์ชนิดรุนแรงต้องใช้ยาบำบัด หนูไปหาหมอที่โรงพยาบาลอื่นมาก่อนแต่ไม่ดีขึ้นทั้งที่ปรับยาไปเยอะมากค่ะ แต่พอมาเจอคุณหมอท่านนี้ หนูรู้สึกว่าหนูสามารถกลับเป็นปกติได้ คุณหมอสอบถามอาการที่เป็นและยาที่เคยใช้ค่ะ แล้วท่านก็วิเคราะห์จากอาการและยาที่เคยใช้ และปรับยาให้ใหม่ค่ะ ซึ่งการปรับยานั้นเป็นที่พอใจสำหรับหนูมากค่ะ ทำให้หนูคิดว่าทำไมไม่มาที่นี่แต่แรก คุณหมอให้ความหวังกับหนูและบอกว่าหนูจะหายเป็นปกติได้ หนูรู้สึกว่ามันต้องหายได้แน่นอน คุณหมอท่านนี้มีอารมณ์ขันมากและเข้าใจวัยรุ่นมากค่ะ หนูคิดว่าถ้าวัยรุ่นที่อยากจะหาหมอจิตแพทย์ก็ควรมาพบกับท่านนี้ดูนะคะ ถึงจะเป็นครั้งแรกที่หนูไปรักษากับท่าน แต่ท่านก็วิเคราะห์ปัญหาและอาการของหนูได้ดีและแม่นยำมากค่ะ	5	Siriraj
ประทับใจการรักษาและดูแลคนไข้ของศิริราชมาก ทีมแพทย์และพยาบาล มืออาชีพ ทุกคนน่ารัก เอ็นดูลูกสาวของดิฉัน ให้ความเอาใจใส่เป็นอย่างดี  ขอบคุณที่นี้จากใจจริงๆค่ะ เราจะไม่ลืมเลย	5	Siriraj
เนื่องจากไม่เคยไปรับการรักษา ไปครั้งแรก เพราะหมอที่ดูแลอยู่แนะนำไป ก็เลย แบบไม่รู้เรื่อง แต่เจ้าหน้าที่ที่ดูแล ให้การบริการดีมากๆๆๆค่ะ เข้า ชัดเจนทุกขั้นตอน ไม่หงุดหงิดใส่ ดูแลคนไข้ตามลำดับอาการป่วย ตอบข้อสักถามดีมาก ทั้ง ๆ ที่คนก็เยอะ คนไม่เข้าใจก็เยอะ ชอบค่ะ ดีกว่ารพ เอกชนอีก ที่ไม่ค่อยดูแลเราแบบนี้เลย เป็นกำลังใจให้เจ้าหน้าที่ทุกคนเลยนะค่ะ สู้ ๆ	5	Siriraj
ตั้งแต่เจ้าหน้าที่ รวมไปถึงพยาบาลและหมอ ให้บริการดีมากไม่มีอาการหงุดหงิดหรือแสดงสีหน้าไม่ดีกับคนไข้เลย รักษาดี ช่วยเหลือผู้ป่วยที่ยังช่วยเหลือตัวเองไม่ได้แบบว่าดีเยี่ยมมาก ถ้ามีลูกคนต่อไป จะคลอดที่โรงพยาบาลศิริราชเหมือนเดิม	5	Siriraj
ได้ไปส่องก้ลองตรวจลำไส้ หมอให้ดูภาพภายในำไส้ แย้วทึ่งมาก ประทับใจ คุณหมอแจงรายละเอียดชัดเจน ภายในเป็นแผล หมอซ่อมแซมให้เรียบร้อย	5	Siriraj
หมอเก่ง สามารถหาสาเหตุอาการป่วยของคุณพ่อ และชาวยรักษาได้ดีด้วย	5	Siriraj
พยาบาลใจดี	4	Siriraj
เคยเป็นต่อมน้ำเหลืองอักเสบและภูมิแพ้ แล้วได้รักษาที่ศิริราชของคุณหมอดูแลคนไข้ดีมาก ตรวจหาสาเหตุอย่างละเอียด ตอนเจาะน้ำเหลืองที่คอมาตรวจ มือเบามาก แล้วก็นัดทุกสัปดาห์เพื่อติดตามอาการให้ยาติดต่อกันจนทำให้อาการดีขึ้นค่ะ	5	Siriraj
เจ้าหน้าที่ตอบทุกคำถามแม้ผู้ป่วยจะเยอะแค่ใหน	5	Siriraj
ต้องช่วยตัวเองทุกอย่าง ตั้งแต่เดินเอกสาร จนถึง จองห้องพักก็ต้องทำเอง เข้าใจว่าเป็น รพ รัฐ แต่ก็น่าจะมีการจัดการที่เป็นระบบมากกว่านี้	3	Siriraj
พยาบาลดูแลดีมากทั้งการพูดการจาไม่แบ่งชนชั้น	5	Siriraj
ประสบการคือ วันนั้นเป็นวันที่23ตุลาคม ชึ่งวันนั้นเราปวดท้องคลอดลูกมาก ก้อเอาเราไปนอนรอที่เตียงเข้าน้ำเกลือ ฉีดยาเร็งคลอด ทิ้งเรานอนไว้ที่เตียง แล้วพยาบาลไปนั่งเล่นมือถือ พอได้1ชั่งโมงผ่านไปเราเลยเรียก พยาบาลคะหนูอยากเบ่งคลอดค่ะ ก็ไม่สนใจ เล่นมือถือต่อ พออีก5นาทีต่อมา เราเลยตะโตนบอกหมอว่า ไม่ไหวแล้วค่ะ จะคลอดแล้ว จนกระทั่งลูกหลุดออกมาทั้งตัว หมอพยาบาลค่อยวิ่งมา....รับลูกเราที่คลอด ...ไม่อยากให้เกิดขึ้นอีกนะคะ อยากให้สนใจคนไข้มากกว่านี้	3	Siriraj
จำนวนแพทย์ไม่เพียงพอ รอนานมาก พอได้พบแพทย์พูดจาฮ่วนๆ หน้าตาไร้อารมณ์ในการให้บริหาร คิดบวกคือแกคงเหนื่อย	3	Siriraj
คุณหมอเก่งมาก ใส่ใจรายละเอียด แต่ที่เข้ารักษาเป็นคลีนิคพิเศษ ทำงานใกล้เคียงกับเอกชน	5	Siriraj
