0	score	hospital
ครั้งนี้ไปพบแพทย์ด้วยอาการประจำเดือนมาไม่ปกติ ก่อนไปก็ปรึกษาคนใกล้ตัวว่าควรไปพบแพทย์ที่ไหนดี มีคนบอกว่าให้ไปศิริราช แว่บแรกคือไม่อยากไป รพ.รัฐรอนานเป็นวันๆแน่ ที่จอดรถก็ไม่สะดวก บัตรคนไข้ก็ยังไม่ได้ทำ แต่ปรากฏว่าไม่ใช่อย่างที่คิดไว้เลยค่ะ เราสามารถเข้าไปสมัครบัตรคนไข้ โดยการลงทะเบียนผ่านเว็บไซต์ของโรงพยาบาลได้ เมื่อได้หมายเลข HN มาแล้ว เราก็โทรไปขอนัดคิวเพื่อพบคุณหมอได้เลย เพื่อนแนะนำให้ไปคลินิกนอกเวลา เสียค่ารักษาแพงขึ้นอีกหน่อย แต่เร็ว ก็เลยโทรไปนัดคุณหมอ ที่นี่ระบบเค้าจะดีมากค่ะเมื่อโทรไปพยาบาลจะนัดเวลาและแจ้งคิวให้เราทราบพร้อมกับบอกให้เรามาก่อนเวลาครึ่งชม. พอถึงวันนัด ก็ไปพบพยาบาลที่หน่วยคัดกรอง ถึงจุดนี้จะต้องชั่งนน.และวัดความดัน ใช้เวลาไม่นานเลย หลังจากนี้ก็ไปนั่งรอตามคิว ซึ่งก็ได้พบแพทย์ตามเวลา(อาจจะก่อนด้วย) การรักษาก็ซักถามละเอียด มีการตรวจอย่างละเอียด ที่สำคัญคุณหมอได้อธิบายทุกอย่างที่คนไข้ถาม ไม่ได้รีบๆตรวจรีบๆทำให้เสร็จ คุณหมอให้อุลตร้าซาวด์ภายใน ให้ตรวจมะเร็งปากมดลูก ขณะที่อ่านผลอุลตร้าซาวด์คุณหมอก็ซักถามประวัติเราไปเรื่อยๆ ผลออกมาก็คือเจอเนื้องอกที่รังไข่ คุณหมอแนะนำให้ผ่า ขั้นตอนหลังจากนี้คือจะต้องส่งเรื่องไปยังคณะกรรมการเพื่อให้คุณหมอหลายๆท่านร่วมกันพิจารณา ว่าเคสของเราสมควรต้องผ่าตัดหรือไม่ ก็จะมีคุณหมอในคณะกรรมการเรียกให้ไปอุลตร้าซาวด์ซ้ำอีกรอบ เนื่องจากการผ่าเอารังไข่ออกจะทำให้ไม่มีฮอร์โมนเพศอีก คุณหมอเลยอยากจะแน่ใจว่าการตัดสินใจจะผ่าตัดเป็นวิธีที่ดีที่สุดสำหรับคนไข้ และพอทุกอย่างเรียบร้อย ก็จะต้องไปตรวจเลือดเช็คสภาพความพร้อมของร่างกายก่อนผ่าตัด ทั้งนี้เพื่อความปลอดภัยที่สุดของคนไข้ การจองห้องก็ไม่ยุ่งยาก พยาบาลจะนัดคิวที่คุณหมอว่างที่จะทำการผ่าตัด แล้วคนไข้ก็สามารถไปจองห้องพิเศษ ซึ่งระบุราคาห้อง ขนาด และแบบของห้องไว้ชัดเจน รวมถึงราคาอาหารด้วย แล้วพยาบาลก็จะแจ้งวิธีเตรัยมตัวก่อนวันมาผ่าตัด การรับประทานอาหารก่อนผ่าตัด โดยรวมๆแล้วการบริการที่ศิริราช ดีน่าประทับใจมากที่สุด พยาบาลก็พูดจาไพเราะ การคำนึงถึงความปลอดภัยก็ดีเยี่ยม ขั้นตอนการบริการก็รวดเร็ว ค่ารักษาก็ไม่แพงเลยเมื่อเทียบกับโรงพยาบาลเอกชน สรุปคือประทับใจที่ศิริราชที่สุดค่ะ	5	Siriraj
ตอนปลายปี คุณแฟนไปคลอดลูกที่โรงพยาบาลศิริราช ซึ่งเด็กแรกเกิดจะค่อนข้างงอแงและตื่นบ่อย แต่ก็สามารถให้พยาบาลเอาไปอย่ในห้องเนอสเซอรี่ได้ตลอดเวลา ไม่มีอิดออด รวมถึงการดูแลต่างๆ ก็ดีทีเดียว	5	Siriraj
คนเยอะ รอนาน ไม่มีที่จอดรถ พยาบาลไม่สนใจผู้ป่วย ส่วนใหญ่หมออายุยังน้อย ไม่มีประสบการณ์เพียงพอ ต้องมีอาจารย์แพทย์คอยแนะนำ	4	Siriraj
มารับการรักษาตรวจโรคข้ออักเสบรูมาตอยส์ เรียกเข้ามารอพบหน้าห้องแพทย์ให้รอเป็นชั่วโมง (จริงๆ ก็รอได้นะ) แต่ว่าน่าจะมีเก้าอี้ให้คนไข้นั่งรอ เพราะคนไข้ที่เป็นโรคนี้แต่ละคนจะมีอาการปวดข้อกันตลอด ให้มายืนรอนานๆ อย่างนี้ คนไข้กลับบ้านต้องมีอาการกำเริบกันอีกแน่ (เราเป็นต้น)	3	Siriraj
หมอและพยาบาลห้องคลอดดูแลเอาใจใส่ดีมากค่ะ	5	Siriraj
หาหมอคลีนิคนอกเวลา   ไปตามนัดหมาย วัดความดัน ได้บัตรคิว ไปนั่งรอหน้าห้องหมอ  แต่สิ่งที่บกพร่องคือ  ไม่รู้ว่าถึงคิวไหน  เรียกแต่ชื่อ ไม่เรียกเลขหมาย และแจ้งว่า ไม่ได้เรียงตามเลข แล้วจะให้บัตรคิวมาเพื่อ?!!	4	Siriraj
คุณหมอและพยาบาลเก่งและมีประสบการณ์มากให้ความรู้ตอบคำถามได้ดี ใจเย็น พูดจาเพราะถึงจะมีคนไข้เยอะก็ตาม	5	Siriraj
เราพาคุณป้าที่ป่วยด้วยโรคงูสวัดไปหาคุณหมอด้านภูมิแพ้ที่รักษากันอยู่แล้วแต่ด้วยคิววันนั้นเต็มเราก็ไปตามคำแนะนำของเจ้าหน้าที่เป็นคลีนิคนอกเวลาคิดว่าต้องรอจนคนไข้นัดตรวจเสร็จก่อนถึงจะได้ตรวจแต่กลับเป็นว่าเรายื่นบัตรแล้วบอกอาการนั่งร สัก20นาทีก็ได้ตรวจไม่เสียเวลารอคิวนานบางแผนกต้องรอจนคนไข้นัดตรวจเสร็จแต่เราก็เข้าใจ	5	Siriraj
เป็นระเบียบและไม่ค่อยวุ่นวายเท่าไรถึงคนจะเยอะก็เป็นระเรียบและสะอาดค่ะ	5	Siriraj
มีการเปลี่ยนแปลงเรื่องบริการที่ดีขึ้นในบ้างส่วนทำให้ได้รับบริการที่เร็วขึ้นกว่าเดิมแต่ก็มีในส่วนจองการชำระเงินและการจ่ายยายังคงใช่เวลาในการรอนานเหมือนเดิม ส่วนแพทย์ที่รักษาประจำจะให้ข้อมูลและตอบข้อสงสัยที่ดีมาก	4	Siriraj
คนมาใช้บริการ รพ.เยอะมาก การให้บริการยังดีเหมือนเดิม	5	Siriraj
ส่วนที่ไปทำการรักษาคือแผนกจิตเวช โดยรวมแล้วระบบของที่นี่ก่อนหน้านี้ค่อนข้างน่าสับสน แต่ระยะหลังศิริราชปรับให้เป็นระเบียบและเข้าใจง่ายขึ้นมาก การนำเทคโนโลยีเข้ามาปรับปรุงเพื่อแก้ไขปัญหาคนแน่นอย่างบันไดเลื่อนและแบ่งพาร์ตโรงพยาบาลให้มีส่วนที่ให้บริการคล้ายเอกชน ทำให้ประทับใจเรื่องของตัวเลือกในการเข้าถึง(ถึงแม้ส่วนนี้จะดูเป็นการให้บริการแบบต่างมาตรฐาน แต่พอทำความเข้าใจได้เมื่อพิจารณาค่าครองชีพและคุณภาพชีวิตอื่นๆของคนไทย)  หน่วยจิตเวชมีการให้บริการดีและเจ้าหน้าที่ทั้งแพทย์และพยาบาลเป็นมิตร การใช้ท่าทาง ภาษากาย และสีหน้าที่ไม่ทำให้ผู้รับบริการรู้สึกอึดอัด  ในส่วนของการรับยา เกิดปัญหาขึ้นค่อนข้างบ่อย การส่งใบยาไปไม่ถึง ลืมส่งใบยา การให้บริการของเจ้าหน้าที่ที่บางครั้งมีการเสียมารยาท  (โดยรวมไม่ต้องการให้คะแนนน้อย เมื่อปัญหาใหญ่คือทางเลือกด้านสาธารณสุขในประเทศไม่ได้มีมากพอ ฉันจึงมองว่า ปัญหาการจัดการของรัฐต่างหากที่ทำให้โรงพยาบาลรัฐที่มีคุณภาพอย่างศิริราชต้องมาแบกรับมากกว่าโรงพยาบาลอื่นๆ)	4	Siriraj
การบริการถือว่าดีปานกลาง แต่ก็ขึ้นกับแต่ละแผนก แต่การรักษาค่อนข้างมั่นใจว่าดี เนื่องด้วยส่วนใหญ่แพทย์จะมากด้วยประสบการณ์ ที่ไปหาจะเป็นคลีนิคนอกเวลา ซึ่งราคาเมื่อเทียบกับเอกชนแล้วถือว่าโอเคเลยคับ โดยรวมโอเคคับ	3	Siriraj
ตึกสมเด็จพระศรี10/1บริการดีมากคะถึงจะเป็นห้องสามัญหมอมา7โมงเช้า2เวลาเลยคะหากเคสไหนมีปัญหาเกี่ยวกับโรคแทรกซ้อนในการตั้งครรภ์จะมีหมอเฉพาะทางโรคนั้นๆมาติดตามอาการร่วมวางแผนประชุมอีกที  ยอดเยี่ยมมากคะ	5	Siriraj
แพทย์เชี่ยวชาญเฉพาะด้าน พยายาบาลให้การช่วยเหลืออย่างดี	5	Siriraj
พยาบาลเอาใจใส่ดี  พูดจาสุภาพ  คุณหมอก็แนะนำการดูแลตัวเองอย่างละเอียด	5	Siriraj
เมื่อวานได้ไปตรวจสุขภาพที่โรงพยบาลศิริราชมาค่ะ อย่างแรกที่ประทับใจมากก็คือ หมอพูดจาแนะนำดีมากค่ะ รวมทั้งพยบาลที่อยู่ในนั้นเวลาถามถึง ห้องน้ำอยู่ใหนค่ะ? หรือ ถามเรื่องอื่นๆ ก็จะตอบมาดีค่ะ บริการดีมากค่ะ	4	Siriraj
ตอนแรกที่ชั้นแรกจะวุ่นวายมากเพราะทุกคนต้องผ่านการคัดกรองที่นี่ แต่พอแยกชั้นไปก็จะเร็วขึ้น ตอนนี้มีบันไดเลื่อนช่วยให้ขึ้นลงสะดวก	4	Siriraj
ทางรพศิริราชเขาวิเคราะห์สาเหตุของโรค2-3คนเผื่อความแน่ใจดีจร้าถ้าไม่ชัวร์เขาก็ให้ส่องกล้องเผื่อหาสาเหตุที่แน่ชัดมากขึ้น	5	Siriraj
ความประทับใจคือการรักษาที่มีเครื่องที่ทันสมัยช่วยรักษาให้เราหายจากการเจ็บป่วย	4	Siriraj
การให้บริการมีความรวดเร็ว แต่ขั้นตอนการให้บริการยังไม่ค่อยชัดเจนเท่าไหร่	4	Siriraj
มีระบบการบริหารจัดการดี แพทย์ชำนาญการระดับอาจารย์หมอเยอะ ผู้ป่วยมาก	4	Siriraj
1. แพทย์บางท่านถามมากไม่ได้คำตอบที่ได้บางครั้งบอกว่าผมไม่ได้ดูโรคนั้นโรคนี้คืดรักษามานานเป็น 10-20 ปีแล้วถามแค่นี้ก็ไม่ได้ 2.ใบนัคตรวจครั้งต่อไปไม่ค่อยชัดเป็นใบบาง ๆ น่าจะทำให้ดีกว่านี้ 3.ระบบรอใบนัด ระบบซื้อยา และชำระเงินบางครั้งช้ามาก น่าจะเป็นไปจ่ายเงินตรงไหนของโรงพยาบาลน่าจะดีกว่า	3	Siriraj
คนไข้จำนวนมาก อาจต้องรอนานหน่อย แต่การรักษาเป็นมาตรฐาน	4	Siriraj
ไว้ใจ วางใจ เชื่อใจ	4	Siriraj
ไปรักษามาก็หลายที่แต่รู้สึกดีกับที่ศิริราชถึงแม้จะรอนานแต่ก็โอเคสำหรับการซักถามและรักษา ยาที่ให้ก็ดูจะใส่ใจว่าควรกินแบบไหน ไม่ใช่มีอะไรก็ให้มา ถึงแม้จะเป็นโรงพยาบาลรัฐที่มีคนมาใช้บริการเยอะแต่บุคลลากรก็มีมากพอที่จะให้บริการ	5	Siriraj
ดิฉันพาลูกไปหาหมอที่ร.พศิริราชมาค่ะไปทุกเดือนเรยเพราะต้องพาน้องไปฉีดวัคซีนค่ะพอดีดิฉันเข้าโครงการแม่วัยรุ่นค่ะโครงการนี้ดีมากเรยค่ะมีค่าเดินทางให้วัคซีนก้อฉีดฟรีพยาบาลประจำโครงการก้อบริการดีพูดจาไพเราะนักศึกษาพยาบาลก่อเฟรนลี่กะเด็กดีค่ะดิฉันคลอดลูกที่นี่ค่ะแล้วก้อมีพี่คนนึงมาชวนเข้าโครงการนี้ค่ะการบริการโดยรวมคือดีมากๆโดยเฉพาะโครงการของ ร.พ ค่ะ	4	Siriraj
มีโอกาสเป็นคนไข้ของโรงพยาบาลศิริราชซึ่งเราก็ทราบกันดีว่าเป็นโรงพยาบาลรัฐบาลที่ต้องรองรับคนไข้จำนวนมาก แต่พอได้เข้าเป็นคนไข้กรณีกระทันหัน ทำให้ได้ทราบว่าคุณหมอและพยาบาลทุกท่านของโรงพยาบาลรัฐนั้นทำงานหนักมากและไม่มีเวลาส่วนตัวจริง ๆ อีกทั้งอาคารและอุปกรณ์ทางการแพทย์ยังมีจำนวนไม่เพียงพอต่อการรักษาคนไข้ที่มีฐานะไม่ดี จึงได้แค่เพียงร่วมบริจาคเงินสมทบมูลนิธิตามกำลังที่จะพอจะช่วยได้ และขอขอบพระคุณคุณหมอและพยาบาล รวมทั้งเจ้าหน้าที่ทุกท่านของโรงพยาบาลที่คอยดูแลในช่วงที่พักรักษาอาการป่วยที่โรงพยาบาลมา ณ ที่นี้ด้วยค่ะ	5	Siriraj
มีแพทย์ผู้เชี่ยวชาญมากมาย ไว้ใจได้ รักษาดี	5	Siriraj
พาคุณยายไปผ่าเข่าค่ะ ทั้งคุณหมอและคุณพยาบาล น่ารักมาก เข้าใจคนแก่ ดูแล และเป็นกันเองมากค่ะ คุณหมอและพยาบาลประจำตึกสลากกินแบ่ง ชั้น5 ประทับสุดๆ	4	Siriraj
แพทย์กับพยาบาลที่นี่ทำงานดีมากค่ะ ดิฉันไปตรวจตาตั้งแต่เกิดจนตอนนี้อายุ 20 ก็ยังไปอยู่คนไข้ คนป่วยที่รอคิวตรวจเยอะมาก แพทย์คนนึงรับคนไข้ เกือบ 100 คน แต่แพทย์และพยาบาลที่นี่ก็ยังยิ้มแย้มแจ่มใส ตอนรับคนไข้ ให้คำอธิบาย ชี้แจ้งเรื่องต่างๆให้คนป่วยฟัง ถึงแม้บางคร้งดิฉันก็รู้สึกได้ว่าบุคคลเหล่านี้ทำหน้าที่กันเหนื่อยมาก แต่ก็ทำหน้าที่ได้ดี	5	Siriraj
หมอทุกคนตั้งใจทำหน้าที่ตัวเองเพื่อคนไข้ ในแต่ละวันหมอที่ รพนี้ตรวจคนไข้เยอะมากตั้งแต่เช้า หมอเก่งและวินิฉัยโรคได้เม้นยำ ไม่เลี้ยงไข้	5	Siriraj
มีคนเยอะมาก หมอทำงานหนักแทบไม่ได้พัก แต่ใช้เวลาตรวจแค่3-5นาทีต่อคน	3	Siriraj
รักษาดีค่ะ ดูแลเอาใจใส่ ไปแผนกฉุกเฉิน ทุกอย่างดี ยกเว้นพื้นที่ในการรักษา พื้นที่น้อย คนเยอะ	5	Siriraj
คุณหมอดีมาก แต่หมอห้องแพทย์เวรไม่ค่อยจะโอเคเท่าไร	5	Siriraj
ทีอายุแล้วมีอาการเป็นประจำเดือน20วัน ก็มาหาหมอคือพยาบาลทางตึกนารีเวชก็ให้เข้าไปนั่งรอตรวจ คือเป็นอะไรสมัยโรงบาลรัฐดูแลคนไข้ดีมากขึ้น  แต่ก็ยังนั่งรอนานเหมือนกันแต่ก็เข้าใจค่ะ เพราะวันๆมีแต่คนไข้มากหน้าหลายตา มากคนหลายจังหวัด แต่ก็ขอบคุณคุณหมอกับนางพยาบาลดูแลดีมาก หนี้ค่ะประสบการของเรา	5	Siriraj
การบริการทั่วไปดีตามควร. แพทย์ที่รักษาดูแลเอาใจใส่ดีมาก เพียงแค่คนใช้บริการค่อนข้างมากทำให้ช้าไปบ้าง. ทั่วๆไปโดยรวมดี	4	Siriraj
