0	score	hospital
ผมเริ่มการรักษาที่โรงพยาบาลแห่งนี้มา 6 ปี ต่อเนื่อง เนื่องจากเป็นโรคไวรัสตับเอ็กเสบบี การเข้ารักษาในครั้งแรกก็ดูจะยุ่งยาก และใช้เวลาอย่างมาก เนื่องจากเป็นคนไข้ใหม่ แต่หลังจากนั้นเมื่อมีใบนัดครั้งต่อไปแล้ว ก็ไม่นานเท่าไหร่  มีคลีนิคนอกเวลาสำหรับนัดคุณหมอประจำที่ตรวจ  ถ้าไม่สะดวกมาในเวลาทำการด้วย รักษาดูอาการอยู่หลายปี  ค่าไวรัส ค่าตับอักเสบก็ลดลง แต่ก็มีภาวะตับแข็ง เนื่องจากใช้ชีวิตก่อนรักษาไม่ดูแลตัวเองประมาท เสี่ยง  คุณหมอดูแลดีมาก คอยหมั่นให้อัลตร้าซาวล์ดูเนื้อตับ จนกุมภาพันธ์ปี 2516 ก็พบว่ามีก้อนที่เนื้อตับ ทำ MRI หมอวินิจฉัยว่าเป็นมะเร็ง ผมเคยถามหมอว่าถ้าเป็นมะเร็งแล้วไง  ผมก็ต้องตายไม่ใช่เหรอ หมอบอกรักษาได้ถ้ารู้เร็วตัดออกได้  คุณหมอที่ดูแลเรื่องตับส่งผมไปหาหมอผ่าตัด  โดยรีบนัด หมอผ่าตัดวินิจฉัย แล้วอธิบายวิธีรักษาให้ผมอย่างละเอียด โดยส่งต่อให้หมอรังสีเริ่มทำในขั้นตอนแรก คือให้คีโมที่ก้อนเนื้อ เพื่อยับยั้งการจะเจริญเติบโตของมัน ทางแพทย์รังสีดูจาก MRI ของผม สนใจในตัวก้อนเนื้อ เพราะมันดูไม่เหมือนเซลมะเร็ง เลยขอตัดก้อนเนื้อนั้นไปตรวจ ประกฎว่าใช่แหละ แต่ำม่ใช่มะเร็งที่เกิดจากเนื้อตับ  แต่เป็นมะเร็งท่อน้ำดีในตับ การทำงานขั้นต่อมาแพทย์รังสี นัดผมมาอุดหลอดเลือดดำที่ตับข้างขวาที่มีก้อนเนื้อ เผื่อให้มันฝ่อ หลังจากนั้นผมบำรุงด้วยโปรตีนเยอะมาก เพื่อให้ตับโตขึ้นในข้างที่ไม่มีก้อนเนื้อ  เผื่อพร้อมสำหรับผ่าตัด หลังจากหนึ่งเดือนผ่านไป คุณหมอศัลย์มาเช็คขนาดตับผม มันก็โตขึ้นพอสมควร คุณหมอก็นัดผ่าตัด ก่อนการผ่าตัดผมกลัวมาก แต่หลังจากเข้ารับการผ่าตัด เหมือนไม่มีอะไรเกิดขึ้น คุณหมอตัดตับผมไป 60% ตามคำบอกของคุณหมอ  แต่ผมก็ไม่ได้มีอาการอะไรยังสามารถใช้ชีวิตอยู่ได้ดี  แต่ต้องมาติดตามอาการเป็นระยะๆ ต่อมาอีก 4 เดือน พบว่ามะเร็งได้กระจายมาที่ต่อมน้ำเหลืองในช่องท้อง จากการตรวจติดตาม ทางหมอศัลย์บอกว่าต้องให้คีโม เลยส่งตัวไปหาหมอเคมียำบัด หมอเคมีบำบัดอธิบายขั้นตอนและวิธีการรักษา ในขั้นนี้เราจะรักษาไม่หายนะครับ  เป็นเป็นการทำให้อาการสงบ เซลล์มะเร็งไม่รุกราม ไม่เติบโต ตอนนี้ผมให้คีโมต่อเนื่องกันมา 4 ครั้ง โดยให้ติดกัน 2 อาทิตย์ เว้น 1 อาทิตย์ แล้วก็ติดกันอีก 2 อาทิตย์ รวมทั้งหมด 12 ครั้ง  เท่ากับ 6 เข็ม คุณหมอบอกว่าการที่ให้ 2 อาทิตย์เท่ากับ 1 เข็ม มันจะช่วยไม่ให้หนักเกินไปสำหรับผม เพราะตัวยามันแรง ผ่านไป 4 ครั้งโชคดีที่ผมไม่มีอาการแพ้ ไม่อาเจียน ทานได้ มีมึนๆนิดหน่อย โดยรวมโอเค  ไม่เคยท้อ เชื่อมั่นในแพทย์ที่รักษา และการให้คำแนะนำ พยาบาลเอาใจใส่ดีทุกครั้งที่มานอนโรงพยาบาล ถามตอบในทุกข้อสงสัย  ผมจะขอผลเลือดมาดูค่าตับ ค่ามะเร็ง ค่าไต ค่าเลือดต่าง โดยให้พยาบาลอธิบายให้ฟัง เนื่องจากต้องการดูสภาพร่างกายโดยตลอด  ขอบคุณคุณหมอและพยาบาลที่นี่ที่ทำให้ผมมั่นใจในการรักษา ไม่ท้อ	5	Siriraj
คือ ผ่าคลอดคุณหมอคุณพยาบาล ดูแลดีมากค่ะ	4	Siriraj
ไปหาหมอเนื่องจากฮอร์โมนไม่ปกติ ตอนแรกคิดว่าศิริราชจะต้องรอนานมากๆเนื่องจากใช้สิทธิ์บัตรทองแต่ปรากฎคือเดี๋ยวนี้โรงพยาบาลพัฒนาระบบดีมากๆ รอไม่ถึงชั่วโมงได้พบคุณหมอและรับยาภายในสามสิบนาทีหลังตรวจเสร็จ คุณหมอเก่งและให้คำแนะนำอย่างดี พยาบาลและเจ้าหน้าที่ให้การบริการและความช่วยเหลืออย่างเป็นระบบ ดีมากๆค่า ตอนแรกคิดว่าไปรักษาบัตรทองจะต้องรอทั้งวันและเจอบริการไม่ดี ศิริราชสมัยนี้ลบล้างความเชื่อเก่าๆได้อย่างหมดจรดค่ะ	5	Siriraj
โรงพยาบาลที่มีคนไข้มากที่สุด แต่กลับปฏิบัติกับคนไข้ทุกคนอย่างดีที่สุด ถึงแม้คนไข้จะเยอะแค่ไหน พยาบาลและคุณหมอก้อไม่เคยละเลยคนไข้ และปฏิบัติกับทุกคนในมาตรฐานเดียวกัน ตรวจละเอียดเหมือนกัน สอบถามประวัติเหมือนกัน ไม่เคยผ่านเลยจุดใดจุดหนึ่งไป ใส่ใจในทุกรายละเอียด ศรัทธาแพทย์ พยาบาล และพนักงานทั้งหมดในโรงพยาบาลนี้ค่ะ	5	Siriraj
เจ้าหน้าที่ประกันสังคมบริการดีมาก น่ารักใจดี พยาบาลสวย ใจดีทุกคน ห้องแอร์ก็เย็น คิดว่านอนโรงแรม555 ส่วนตัวผมชอบมาก บริการทุกระดับประทับใจต้องศิริราช รอตรวจรอผลเลือด สรุปเป็น ลำไส้อักเสบ นอนไปครึ่งวันกลับบ้านได้	5	Siriraj
คุณแม่ ต้องตรวจจากแพทย์หลายท่าน และแต่ละท่านไม่เชื่อมโยงข้อมูลกัน ทำให้ต้องไป รพ ตามนัด หลายครั้งมากครับ	2	Siriraj
ได้เข้าพบคุณหมอแผนกนรีเวชที่รพ.ศิริราชค่ะ เป็นการตรวจ follow up (ติดตามผล) ในเรื่องของเยื่อบุมดลูกเจริญผิดที่ ท่านเป็นอาจารย์หมอแพทย์หญิงที่น่ารักมากๆเลยค่ะ ท่านยิ้มแย้มเป็นมิตร ซักประวัติเราด้วยความอ่อนโยนต่อผู้ป่วย บอกเราว่าที่เราเป็นโรคนี้ต้องรักษาแบบนี้นะคะ พร้อมทั้งแนะนำว่าต้องปฏิบัติตัวยังไง อาจารย์ท่านอธิบายอย่างละเอียดให้กับเรา ทำให้เรารู้สึกปลอดภัยและอบอุ่นหัวใจมากๆเลยค่ะ และที่สำคัญท่านสอนนักศึกษาแพทย์โดยใช้เคสของเราด้วย ดูท่านอธิบายให้นักศึกษาแพทย์ฟังแล้วท่านทั้งเก่งมากและเมตตาทั้งคนไข้และนักเรียน สัมผัสได้เหมือนกับเจอคนที่ไว้ใจได้มากที่สุด เพราะปกติแล้วการตรวจทางนรีเวชเป็นเรื่องละเอียดอ่อนมากๆ เข้าถึงใจผู้ป่วยอย่างลึกซึ้ง ประทับใจมากๆเลยค่ะ :)	5	Siriraj
สะอาด บริการดีค่ะ	4	Siriraj
ปกติจะเขียนรีวิวเกี่ยวกับเหตุการณ์ที่เกิดขึ้นจริงกับตัวเอง  ที่เลือกโรงพยาบาลศิริราช ทำให้ฉันได้เปลี่ยนชีวิตใหม่  เมื่อก่อนตอนสมัย ปวช ดิฉันเป็นสิว คลีนิกที่ว่าดังไปหมด เมื่อใช้ครีมเค้า รักษากับเค้าก็ดีแต่พอยาหมด ครีมหมดก็เป็นสิวเหมือนเดิม  มีคนแนะนำให้ไปรักษาที่ศิริราช แผนกโรคผิวหนัง นอกเวลา  ครั้งแรกที่ไปก็กลัวๆ กล้าๆๆ แต่เมื่อได้พบกับหมอ หมอแนะนำดีมาก ดิฉันไปรักษาตามหมอ 3 ครั้ง หน้าดีขึ้นมาก มีแต่คนทัก  หลังจากนั้นก็หายไม่ได้ไปหาหมออีกเลย	5	Siriraj
คนเยอะมากเพราะเป็นรพ.รัฐ ค่ารักษาถ้าจ่ายเองถูกกว่าเอกชนเล็กน้อย ตรงค่าหมอจะแค่100แต่ค่ายาก็จ่ายเต็ม แต่จัดคิวงง มีใบนัดมาในใบมีเวลานัดชัดเจน แต่พอมารอจริง เรียกก่อนเวลา ถ้าไม่รอตลอดก็จะเลยคิวไป แต่พยาบาลบริการดี มีเจ้าหน้าที่ตามจุด แค่ต้องรอยานานบ้าง	3	Siriraj
คลีนิคพิเศษ รพ ศิริราช บริการดี จัดระบบ แยกคัดกรองคนไข้ จัดลำดับการเข้าพบแพทย์ได้ดี ทำให้ได้ตรวจเร็ว คนไข้ไม่ต้องรอนานและไม่ตกค้างมาก	5	Siriraj
ดีค่ะ	4	Siriraj
บริการเป็นเลิศ. ถือประโยชน์ส่วนตนเป็นที่ 2. ดูแลคนไข้เป็นที่ 1	5	Siriraj
เคยไปรักษาสิวที่โรงพยาบาลศิริราชค่ะ ประทับใจเพราะคุณหมอให้คำแนะนำเป็นอย่างดี  จ่ายยาพอเหมาะ ถ้าหากไม่หมดก็ไม่ต้องซื้อ ใช้ยาตามหมอสั่งแล้วได้ผล ข้อเสีย นัดครั้งแรกต้องล่วงหน้า 1เดือน มาครั้งแรกทำตัวไม่ถูก พยาบาลไม่ค่อยแนะนำ บางครัังรอคิวนานทั้งๆที่มาตามเวลา	4	Siriraj
เมื่อวัาที่28/12/59 ได้เข้าไปตรวจตามนัดของคลินิคนารีเวช นึกไปนึกมาเราก็มีอาการผมร่วงมาสัก 2 ปีกว่า ไปตรวจกับคลินิคผิวหนังดีกว่า ว่าแล้วก็ขึ้นไปลงทะเบียนได้คิวที่60 ซึ่งเป็นคิวสุดท้ายของ อ.หมอ แต่เราขอลงไปตรวจที่นารีเวชก่อน พยาบาลแจ้งว่าประมาณ 1 ทุ่ม ให้กลับขึ้นมาตรวจน่ะ แต่ 1 ทุ่มเราก้อยังรรวจไม่เสร็จ ผลสุดท้ายทั้งพยาบาลและอ.หมอ ก็นั่งรอตรวจให้ค่ะ	5	Siriraj
การวินิจฉันโรคของหมอ  เข้าใจว่าหมอเจอคนไข้ที่ป่วยด้วยเป็นโรคมะเร็งและอยู่ในระยะสุดท้ายมาเยอะ  ต้องพูดซ้ำแล้วซ้ำอีกทำให้อาจเบื่อที่จะต้องพูดอ้อมโรคกับคนไข้ระยะสุดท้าย  แต่ด้วยจรรยาบรรณของหมอก็ไม่ควรพูดเพื่อหยุดการรักษาแล้วบอกว่ารักษาไปก็ไม่หาย  ก็ได้ถือว่ารักษาแล้ว  ด้วยน้ำเสียงตะคอกและเสียงน้ารำคาญอย่างนั้นกับคนไข้  ควรจะบอกดีๆหรือไม่ก็แจ้งข่าวกับญาติก็ได้  คนไข้ที่รู้ตัวเองมันก็สิ้นหวังพออยู่แล้ว  มาเจอหมอพูดแบบนี้จะทำให้คนไข้อยู่ต่อด้วยความสิ้นหวัง   คุณชั่งเป็นหมอที่ไร้ความเมตตาเสียจริงๆ  ควรปรับปรุงด้านการใช้วาทะในการพูดกับคนไข้เป็นอย่างมาก	1	Siriraj
มานอนโรงพยาบาลศิริราช ห้องพัก ดี แต่ขาดการบริการที่จอดรถ	3	Siriraj
เป็น รพ.รัฐบาลที่ให้บริการอย่างดีเยี่ยม พยาบาลยิ้มแย้มแจ่มใส อาจจะต้องไปเช้าเพื่อได้พบหมอ แต่การรอพบแพทย์ก็ไม่นานจนเกินไป	5	Siriraj
ชีวิตมีค่าในบางเวลาไม่อาจรอได้ เวลามารพ.มักจะต้องทำเองบ้างแต่ก็ดีกว่ารอคะ เพราะเวลาของหมอและพยาบาลมีความสำคัญยิ่งในรพ.ใหญ่แล้วถ้วนแต่แลดูวุ่นวายมาก เพราะฉะนั้นอะไรที่เราสามารถช่วยเหลือตัวเองได้ก็ทำได้ ไปจะได้ไม่เป็นภาระแก่บุคคลใครให้เป็นความล่าช้า	5	Siriraj
หมอให้คำปรึกษากระจ่างดีค่ะ เข้าใจง่าย เจ้าหน้าที่ก็ต้อนรับดีค่ะ พูดจาดี	4	Siriraj
พยาบาลดูแลหลังจากคลอดลูกดีมาก บอกและแนะนำดีมากโดยเฉพาะช่วยเหลือเรื่องการให้นมลูกได้ดีจริงๆ ถ้าไม่ได้พยาบาลคอยแนะนำ คอยสอนในทุกเรื่องที่ผู้เป็นแม่ควรทำ เราก็คงทำอะไรไม่เป็นเลย ต้องขอบคุณพยาบาลทุกท่านจริงๆที่ดูแลเราเป็นอย่างดี	4	Siriraj
จริงๆก็ไม่ได้ไปรับการรักษานะคะ แต่บริจาคเลือดค่ะ พยาบาลและเจ้าหน้าที่น่ารักมากๆ... ตอนบริจาคเลือดเสร็จ แกล้งเป็นลม (ตอนนั้นไปกับเพื่อน จะแกล้งเพื่อนเล่นตรงหน้าลิฟ) เจ้าหน้าที่วิ่งมาจากในห้องบริจาคเลือด มาถามใหญ่เลยว่าเป็นอะไรมั้ย ประทับใจมากเลยค่า	4	Siriraj
ให้บริการช้า รคิวนานใสก ไปอย่างต่ำเสับเวลาค่อนวัน แยากฝห้ปรับปรุงเรื่องกานบริการ	2	Siriraj
หมอเข้าใจลักษณะโรคที่เป็น จ่ายยาตรงโรคกินยา2วันไม่มีอาการ	4	Siriraj
แพทย์ พยาบาล บุคคลากรทุกส่วนงานเป็นมืออาชีพมากๆรู้วิธีรับมือกับภาวะวิกฤตต่างๆ รวมถึง ปัญหาส่วนตัวของคนไข้เอง และญาติของคนไข้	5	Siriraj
ตัวเองได้คลอดก่อนกำหนดที่โรงพยาบาลศิริราชซึ่งไม่เคยคิดว่าโรงพยาบาลรัฐบาลจะบริการได้รวดเร็ว และดีอย่างนี้ เพราะเราเป็นเคทฉุกเฉิน อายุครรภ์25week+5 ตอนแรกจะเข้าไปตรวจเรื่องน้ำคล่ำกับตกขาวเยอะ แต่พอถึงโรงพยาบาลระหว่างจะไปยื่นบัตรน้ำคล่ำไหลออกมาเราก็ตกใจทำไรไม่ถูกเลยเดินไปห้องที่มีเจ้าหน้าที่ยืนอยู่และบอกเค้าว่าน้ำคล่ำไหล แค่นั้นเจ้าหน้าที่รีบหารถเข็นมาให้นั่ง แล้วก็มีเจ้าหน้าที่มาซักประวัติ สักพักก็พาขึ้นไปห้องรอคลอดเพื่อตรวจว่าใช่น้ำคล่ำจริงรึเปล่า คุณหมอทำการตรวจไปซักประวัติไปสรุปเป็นน้ำคล่ำจริงๆเลยต้องนอนรอคลอดเลย ระยะเวลาทั้งหมดรวดเร็วมาก ทุกคนเป็นมืออาชีพใส่ใจคนไข้ ยิ่งกว่าโรงพยาเอกชนซะอีก ทำให้รู้สึกประทับใจมากค่ะ	5	Siriraj
