0	score	hospital
เป็นโรงพยาบาลที่ดีมากๆคะเคยรักษาเนื้องอกที่มดลูกพยาบาลเอาใจใส่คนไข้มากๆๆถึงมากที่สุดนอนห้องรวมเหมือนห้องพิเศษเลยคะอยู่ใกล้ชิดพยาบาลตลอดเวลาพยาบาลถามอาการทุกๆ1ชม.ห้องน้ำ เตียงนอน อาหารการกินเค้าดูแลเราเหมือนญาติจริงๆนะคะอาบน้ำเช็ดตัวขอปรบมือให้พยาบาลทุกๆคนจริงๆคะไม่ผิดหวังเลยคะที่เข้ารักษาตัวที่รพ.นี้นะคะประทับใจมากๆคะอยากรักษาที่ศิริราชต่อไปคะขอบคุณคะ	5	Siriraj
รพ.ศิริราช คุณหมอและพยาบาลน่ารักมากค่ะ ให้คำแนะนำเกี่ยวกับฌรคดีมาก พาลูกไปตรวจตามนัดคุณหมอให้คำอธิบายดีทุกครั้ง ขั้นตอนการตรวจไม่ยุ่งยากห้องรับยาแยกเป็นสัดส่วน เจ้าหน้าที่ห้องยาให้คำอธิบายยาดี ถึงแม้เวลาเดินทางไป รพ.จะไกลแต่ก็ไม่เหนื่อยค่ะกลับมาสบายใจทุกครั้งคุณหมออธิบายแนวทางการรักษาดีมากไม่ต้องกังวลเรื่องโรค	5	Siriraj
"พาคุณย่าไปรักษาโรคมะเร็ง บริการดี รวดเร็วเป็นกันเอง น่ารักมากเลยค่ะ จากคุณย่าหมอบอกเป็นมะเร็งเต้านมระยะสุดท้ายอยู่ได้อีกไม่นานต้องนอนติดเตียงร้องเจ็บตลอดบอกทรมาร พาย่าไปให้คีโม พาไปรักษาหมอให้ยามาทานเรื่อยๆ จนตอนนี้ย่าดีขึ้นเรื่อยๆแล้วค่ะ จากที่เป็นตอนนั้นตอนนี้ผ่านมา2ปีแล้วค่ะ ย่าแข็งแรง เดินได้ กินได้ปกติจนถึงวันนี้เลย เพราะมีหมอและการให้บริการที่ดีจากทางโรงพยาบาล"	5	Siriraj
"พาคุณแม่ไปคลินิกนอกเวลา สูตินรีเวช ขั้นตอนคือ ทำบัตร รพ สามารถทำออนไลน์ หรือไปทำที่ตึกopdชั้น 1 จากนั้น เมื่อได้HN โทรไปนัดที่คลินิกนอกเวลา แจ้งชื่อ HN ระบุวันเวลา ระบุชื่อแพทย์หรือไม่ก็ได้ เจ้าหน้าที่รับนัดให้ข้อมูลได้ดี ละเอียด โทรติดง่ายไม่ยากค่ะเมื่อถึงวันนัด มาถึงก่อนอย่างน้อย ครึ่งชั่วโมง -1 ชั่วโมง คนไข้ค่อยข้างเยอะค่ะ รออย่างน้อย 1-2 ชั่วโมงประทับใจคุณหมอ คุณพยาบาล เจ้าหน้าที่ทุกท่าน คบินิกสูตินรีเวช นอกเวลา บริการดีมากๆ"	5	Siriraj
หน่วยจิตเวชศาสตร์ให้การดูแลผู้ป่วยที่มีปัญหาด้านอารมณ์ จิตใจ บรรยากาศภายในแผนกค่อนข้างสบายตา เจ้าหน้าที่ แพทย์ พยาบาล เป็นกันเอง การรับบริการอาจจะไม่ได้เร็วเท่าโรงพยาบาลเอกชนแต่ก็ไม่ได้ช้ามาก ไม่ต้องรีบมารับคิวหมอตั้งแต่เช้ามืด มีระบบนัดคิวผู้ป่วย  มีบริการรับยาแยกออกมาจากผู้ป่วยนอกแผนกอื่นๆ ยกเว้นหลัง 16.00 น.ที่ต้องลงไปรับยาที่ห้องยาชั้น 1 การไปหาครั้งแรกบางครั้งถ้าคนไข้เยอะมากเป็นพิเศษอาจเป็นการทำนัดเพื่อมาในครั้งต่อไปแทน ( แต่เราไปก็ได้ตรวจเลย ) ค่าบริการการให้คำปรึกษา ( ง่ายๆ คือ ค่าหมอ) สำหรับผู้ป่วยใหม่ ไม่นับรวมค่ายา ไม่เกิน 30 นาที 600฿ ครั้งต่อไป 300฿ เราพบหมอเกิน 30 นาทีหลายครั้งมากตั้งแต่ครั้งแรก ก็ได้ราคานี้ หมอใจดี สิทธิ์ก็ตามปกติทั้งจ่ายเอง ข้าราชการ บัตรทอง ประกันสังคม แล้วแต่คน ที่นี่เป็นโรงเรียนแพทย์ ดังนั้น แพทย์จะหมุนเวียนตลอด แต่ก็จะมีอาจารย์แพทย์ประจำ แพทย์ที่หมุนเวียนไม่ใช่นักศึกษาแพทย์ แต่เป็นแพทย์ที่เรียนเฉพาะทาง ก็คือ จิตแพทย์นั่นแหละ ที่นี่ปกติแล้วส่วนใหญ่ถ้าจะมีการแอดมิดคนไข้ก็จะส่งต่อไปที่สถาบันกัลยาฯ นอกจากนี้ยังการทดสอบต่างๆ เช่น การทดสอบไอคิว หรือมีการให้คำปรึกษา การทำจิตบำบัด การเข้ากลุ่ม โดย นักจิตวิทยาคลินิก ด้วย	5	Siriraj
ให้การรักษาดี รวดเร็ว มีนักศึกษาแพทย์มาร่วมวินิจฉัยด้วย เนื่องจากข้อมือหลุดจากการเล่นบาส แล้วล้ม การรักษาไม่ได้ถึงกับผ่าดัด รักษาโดยการเอาตุ้มน้ำหนักมาถ่วงที่ข้อศอกเพื่อให้มันยืดออก แล้วจัดข้อต่อให้เข้าที่ ฉีดยาแก้อักเสบ และเข้าเผือกไว้ อีก1เดือนก็มาเอาเผือกแข้งออก มาดอาการ พอหมอเห็นว่าอาการดีขึ้นก็เปลี่ยนมาเป็นเผือกออ่อน	5	Siriraj
ที่นี่บริการดีมากเลยครับ คนเยอะแค่ไหนเจ้าหน้าที่ก็ทำงานเต็มที่ไม่มีอาการแสดงสีหน้าไม่พอใจให้เห็นเลยครับ เคยพาเพื่อนไปตรวจแล้วเราหาตึกผู้ป่วยไม่เจอ เจ้าหน้าที่ก็พาเราไปถึงที่เลยครับ ต้องรอคิวนานเนื่องจากคนเยอะ แต่เจ้าหน้าที่บริการดีมากเลยครับ สิ่งอำนวยความสะดวกก็มีพร้อมให้บริการคนไข้ โดยรวมแล้วถือว่าพอใจมากเลยครับ #ขอบคุณที่รพ.ให้การดีๆแบบนี้นะครับ	5	Siriraj
เรารักษาที่นี้ครั้งแรกด้วยอาการซึมเศร้า พยาบาลยิ้ม น่ารัก พูดเพราะทุกๆคนเลย เขาไม่แสดงออกเลยว่าหงุดหงิด หรือรำคาญผู้ป่วยที่แสดงออกเสียงดัง หรือควบคุมไม่ได้ เราไม่รู้สึกว่าตัวเองเป็นคนแปลกแยก กลับมีเพื่อนคุยในเรื่องคล้ายๆกัน ระหว่างรอคุณหมอ คุณหมอทุกท่านใจดีมากๆเลย เภสัชก็น่ารัก เราเลือกไม่ผิดจริงๆที่รักษาที่นี้ เรารักศิริราชมากๆเลย	5	Siriraj
บริการเยี่ยมรู้สึกปลอดภัยเมื่อเดินเข้าโรงพยาบาลนี้ ทั้งแพทย์พยาบาลทั้งเก่งและมีความสามารถ ทำให้ผมรู้สึงปลอดภัยและสบาบใจเมื่อเจอบุคลากรที่มีคุณภาพอย่างนี้ มีความประทับใจอย่างมากที่จะกลับไปใช้โรงพยาบาลศิริราชอีกครั้ง ขอบคุณที่คอยดูแลกันมาตลอด ขอบคุณจริงๆครับ หากมีโอกาศจะบอกต่อและใช้บริการอีกครับ  ให้5ดาวไปเลย	5	Siriraj
เราเกิดที่ รพ นี้ค่ะ สมัยก่อนแม่บอกเราว่าคุณหมอและพยาบาลทุกคนที่นี่จัยดีดุแลดีไม่เลือกปฎิบัตร จนกับรวยค่ะ รักที่นี่ปัจจุบันเราไม่เคยรักษาตัวที่นี่เพราะเราแข็งแรงดีค่ะส่วนตัวเพราะที่นี่รักษารนรวยคนจนเท่ากันเพื่อประชาชนที่หาเช้ากินค่ำอย่างเราๆค่ะคุณหมอก็เก่งทุกคนค่ะแฟนเตยถุกรถชนแล้วรักษาที่ศิริราชอาการแฟนก่อน รพ.เอกชนที่นึงจะส่งต่อไปศิริราชบอกไห้เราทำไจไม่ไช่50-50แต่30-70เราร้องไห้จนจะเปนบ้าแต่ รพ.ศิริราชทำไห้เราได้แฟนกลับมาและปกติทุกอย่างขอบคุณจริงๆค่ะ	5	Siriraj
"ประทับใจมากๆเลยครับผมเป็นโรคธาลัสซีเมียตั้งแต่กำเนิดและก็ได้รับเลือดที่โรงพยาบาลศิริราชจนผมได้รักษาปลูกถ่ายไขสันหลังทำให้ปมหายจากอาการผิดปกติที่เกิดขึ้นแต่เพราะโรคธาลัสซีเมียเป็นโรคที่ไม่หายขาดแต่โรงพยาบาลนี้ก็ทำให้ผมได้ใช้ชีวิตปกติแบบคนอื่นได้ครับทั้งนี้แล้วสำหรับตอนนี้ผมยังคงต้องตรวจเลือดตลอดเวลาที่คุณหมอนัดเพื่อดูดีเอ็นเอและค่าต่างๆของร่างกายและยังต้องตรวจตาอีกด้วยซึ่งการตรวจทุกอย่างผมตรวจที่โรงพยาบาลศิริราชครับ"	5	Siriraj
คุณหมอ รวมถึงผู้ช่วยพยาบาลและบุคคลากรของโรงพยาบาลดูแลดีครับ ใช้คำพูดน่าฟังสุภาพเป็นกันเองต่อผู้ป่วย ตอนที่เกิดอาการหอบรีบไป โรงพยาบาล คุณหมอรีบเข้ามาดูอาการแล้วใช้เครื่องพ่นยาพ่นให้ ทำให้สบายขึ้นหายใจได้ดีขึ้น หลังจากพ่นยาก็ยังคอยดูแลอีกซักระยะจนหายดีคุณหมอจึงจ่ายยาให้กลับพักผ่อนที่บ้านได้ รวมๆแล้วโอเคกับโรงพยาบาลที่นี่ครับ	5	Siriraj
"เนื่องด้วยตัวเราเองป่วย และต้องรักษาตัวที่โรงพยาบาลศิริราช มาหลายปี การที่มาที่โรงพยาบาลนี้บ่อยๆทำให้สังเกตเห็นได้ว่า บุคคลากรที่นี่มีคุณภาพมากๆ ระดับดีเยี่ยมเลยจริงๆ ประทับใจตั้งแต่ พนักงานรักษาความปลอดภัย พนักงานเคลื่อนย้ายผู้ป่วย พยาบาล จนกระทั่งหมอ ประทับใจไปหมดทุกอย่างเลยจริงๆ วันนี้ตั้งใจเขียนกระทู้นี้ ให้กำลังใจทุกๆคนที่ทำงานในศิริราช พนักงานรักษาความปลอดภัยเราสังเกตว่าเขาจะตรวจดูในอาคารด้วย เดินดูทั่วอาคารเลย ดูแลความปลอดภัยดีมาก เวลาจะข้ามถนน ที่นี่ คนเดินเท้าใหญ่กว่ารถ และรถเข็นคนไข้ ใหญ่ที่สุด คือถ้ามีรถเข็นจะข้ามปุ๊บ โบกให้รถยนต์จอดก่อนเสมอ พนักงานเคลื่อนย้ายผู้ป่วยเป็นอีกหน่วยหนึ่งที่ปลื้มใจสุดๆเมื่อวานสดๆร้อนๆ เราเองต้องนั่งรถเข็น ฝนก็ตก เราเองจะไปจากตึกสยามมินไปโรงอาหาร ก็ให้แม่เข็นไปให้  พอ พี่พนักงานเห็น เขารีบเข้ามาถามว่า ไปไหนครับ เดี๋ยวผมเข็นให้ พอไปถึงหน้าโรงอาหารมันมีน้ำขังจากฝนตกอยู่ เราเห็นแล้วก็จะบอกว่า พี่ส่งตรงนี้ก็ได้คะ เดี๋ยวจะเดินไปเอง(ใช้ไม้เท้าเดิน) กำลังจะอ้าปากพูดเนี่ยแหละคะ ขาพี่แกก้าวลงน้ำมาแล้ว ทุ่มตัวสุดๆ (รู้สึกผิดในใจ) รองเท้าผ้าใบจมเกือบมิดเลยคะ มันต้องอับไปทั้งวันแน่ๆเลย พอถึงที่ เราก็ยกมือไหว้ขอบคุณ พี่พนักงานยกมือรับไหว้ บอกไม่เป็นอะไรครับ แต่รองเท้าพี่แก แฉะเลย ซึ้งใจมากๆ"	5	Siriraj
"ไปพบคุณหมอที่ศิริราชแผนกจิตเวชเป็นคลินิกพิเศษนอกเวลา คุณหมอเก่งมากๆ พูดจาดี ใจดีมากๆ พยาบาลก็น่ารัก สอบถามเรื่องอะไรก็ตอบอย่างละเอียด ไม่เหวี่ยงไม่วีนเลยค่ะสถานที่ก็ดีค่ะ สะดวกสบาย ทางรพ.จัดได้เป็นระบบระเบียบ  สามารถนัดเวลาไปพบคุณหมอได้ค่ะ รอไม่นานเพราะไปตามเวลาที่นัด ถึงจะเป็นคลินิกพิเศษนอกเวลา แต่ค่าหมอไม่แพงเลยค่ะ ค่ายารักษาราคาจะอยู่ที่ยาแต่ละตัวที่คุณหมอจ่ายค่ะ โดยรวมแล้วดีมากค่ะ"	5	Siriraj
โรงบาลศิริราช ถือว่าดีอำดับต้นๆของประเทศเลบ หมอบริการดี พูดจาดี รักโรงบาลนี้สุด เพราะเคยไปใช้บริการมาหลายครั้ง พยาบาลพูดจาเป็นกันเอง เข้าใจผู้ป่วย ไม่รอนาน ไม่มีโรงบาลไหนดีเท่านี้แล้วละครับ ผมเคยไปนอนที่โรงบาลนี้ เหมือนปลายปีก่อน ตอนนั้นไปติดหวัดจสกการไปเที่ยวต่างประเทศ กลับมาเป็นไข้หวักหนัก เลยแอดมิทที่ฌรงพยายาบนี้ ค่าใช้จ่ายไม่แพง ดีกว่าเอกชนไปอีก	5	Siriraj
"กำลังรักษากับหมอหนังศรีษะที่โรงพยาบาลแผนกผิวหนังชั้น 4 ตึกผู้ป่วยนอก ดีมากค่ะให้การรักษาที่ได้รับผลกระทบน้อยที่สุด เคยรักษาที่โรงพยาบาลอื่นแต่ก็กังวลกับผลข้างเคียงตลอดเลย แนะนำให้ไปในเวลาก็ได้ถ้าสามารถไปได้ในวันธรรมดาเพราะค่ารักษาจะถูกกว่าคลินิกพิเศษ ส่วนตัวเคยไปทั้งสองคลินิกแล้วให้การรักษาดีทั้งคู่ คิวของที่ศิริราชไม่ได้รอนานถ้าเราไปตามวันเวลาที่นัดสำหรับผู้ป่วยใหม่นั้นแนะนำ1.ให้เสียเวลาวันหนึ่งไปทำบัตรผู้ป่วยก่อน ชั้น 1 แต่จำตึกไม่ได้เสร็จแล้วก็ทำการนัดคิว2.ให้มาตามคิวที่นัดได้เลย3.พอตรวจเสร็จก็จะมีการทำนัดครั้งถัดไป"	5	Siriraj
บริการดีมาก ตอนแรกได้ยินคำร่ำลือมาว่ารอนานมาก แต่พอไปจริงๆ ทุกอย่างเป็นระบบมาก คือไม่ได้รอนานอะไรเลย หรืออาจจะเป็นเพราะเราไปคลินิคนอกเวลา ^^ ส่วนในเรื่องของการรักษาโอเคมากคะ ขนาดเรารู้ว่าเราเป็นอะไร แต่ตั้งใจไปที่นี่ครั้งแรกเพื่อที่จะเริ่มตรวจใหม่ทั้งหมด แจ้งอาการไปคุณหมอเหมือนทราบทันที  ทีนี้แต่รอผลเลือดยืนยันเท่านั้น	5	Siriraj
เป็นโรงพยาบาลที่ดีมากค่ะบริการดีหมอดีมากๆค่ะ คือวันที่ฉันไปตอนเช้าค่ะ มีการบริการที่ดีมากจองคิวได้ไวมากค่ะ โรงพยาบาลทำให้เรารู้สึกปลอดภัยที่จะมารักษาโรคค่ะ พาพบกับคุณหมอคือคุณหมอที่นั้นใจดีมากค่ะแนะนำให้คำปรึกษาเราละเอียดดีมากและที่สำคัญรักษาโรคได้เชี่ยวชาญมากเป็นคุณหมอที่ดีมากๆทุกคนเลยค่ะ ตอนบริการจ่ายยาก็รอไม่นานค่ะ ในตัวโรงพยาบาลกว้างขว้างมากมีห้องพิเศษรองรับคนไข้เยอะมากค่ะ	5	Siriraj
มาหาหมอจิตแพทย์ครั้งแรกที่นี้ ประทับใจการดูและและพูดของคุณหมอมาก ขอบคุณพยาบาลและเจ้าหาที่ทุกคนค่ะ กล้าบอกเลยว่าค่อนข้างกลัวเพราะระแวง ยิ่งอ่านรีวิวยิ่งกลัวเกี่ยวกับการเข้าพบจิตแพทย์ กลัวโดนด่า กลัวโดนติ กลัวคนขึ้นเสียงใส่ แต่คุณหมอสุภาพมาก และกำชับว่าที่เราเป็นมีทางรักษาให้หายได้ ขอบคุณกำลังใจและสติดีๆจากคุณหมอของศิริราชด้วยค่ะ ไปโรงพยาบาลอื่นจะเดินทางงงกับตึกต่างๆ แต่ทาง รพ.ศิริราชมีการจัดการระบบต่างๆ และตึกต่างๆทำให้เดินหาสถานที่ได้โดยไม่ต้องเสียเวลามากด้วยค่ะ	5	Siriraj
